link,name,price,rating,total_sold,store_name,store_location,product_description,customer_satisfaction,IsRated,total_rating,num_reviews,review_rating_ratio,brand_name
https://www.tokopedia.com/cvkareemamarket/ready-stock-vivo-s1-hp-murah-hp-vivo-ram-8gb-256gb-4500-mah-32-mp-white-247b9?extParam=fcity%3D174%2C175%2C176%2C177%2C178%2C179%23144%2C146%2C150%2C151%2C167%2C168%2C171%2C174%2C175%2C176%2C177%2C178%2C179%2C463%23165%2346%23252%26ivf%3Dfalse%26keyword%3Dhp+murah%26search_id%3D202503010158437659E76192BAE0069WUB%26src%3Dsearch,[ Ready Stock] Vivo S1/Hp Murah/Hp Vivo/ Ram 8Gb+ 256Gb/4500 Mah/32 Mp,2268000.0,2.5,0,Cv Kareema Market Id,Jakarta,"selamat datang di toko kami mohon dibaca sebelum membeli  spesifikasi handphone: technology            :gsm / hspa / lte launch            : announced 2019, july 17 status available      : released 2019, july dimensions            : 159.5 x 75.2 x 8.1 mm (6.28 x 2.96 x 0.32 in) weight                    : 179 g (6.31 oz) glass front                : plastic back, plastic frame sim                             : dual sim (nano-sim, dual stand-by) type                           : super amoled size                             : 6.38 inches, 99.9 cm2 (~83.3% screen-to-body ratio) os android                : 9.0 (pie), funtouch 9 chipset                     : mediatek mt6768 helio p65 (12nm) cpu                     : octa-core (2x2.0 ghz cortex-a75  amp; 6x1.7 ghz cortex-a55) gpu                     : mali-g52 mc2 card slot             : microsdxc (dedicated slot) internal                     : 64gb 6gb ram, 128gb 4gb ram, 128gb 6gb ram, 256gb 6gb ram main camera        : triple 16 mp, f/1.8, (wide), 1/2.8 #34;, 1.12µm, pdaf 8 mp, f/2.2, 13mm (ultrawide), 1/4.0 #34;, 1.12µm 2 mp, f/2.4,  features            : led flash, hdr, panorama nfc                    : no usb                    : microusb 2.0, usb on-the-go sensors                    : fingerprint (under display, optical), accelerometer, proximity, compass charging            : fast charging 18w  kelengkapan handphone : 1)unit hp 2)kabel charger 3)adaptor charger 4)buku panduan 5)jarum sim  garansi toko 1 tahun tidak berlaku jika terjadi human erorr: - terkena cairan - segel rusak / hilang - terbakar - terjatuh  syarat return barang : 1) hanya bisa jika segel masih utuh dan non human error 2) kami tidak akan proses return apabila ada vivo cloud di hp tersebut  3) ongkos kirim dan return sepenuhnya ditanggung oleh pembeli  4) barang saat direturn harus seperti waktu kami kirim dan segel utuh 5) mohon kirimkan video saat unboxing dan video kendala hp yang dialami 6) untuk kerusakan lcd dikenai biaya tambahan 7) garansi tidak",0.0,False,0.0,0.0,0.0,VIVO
https://www.tokopedia.com/laris-jaya-gadget86/samsung-galaxy-a31-6-128-gb-hp-murah-ram-besar-android-murah?extParam=fcity%3D174%2C175%2C176%2C177%2C178%2C179%23144%2C146%2C150%2C151%2C167%2C168%2C171%2C174%2C175%2C176%2C177%2C178%2C179%2C463%23165%2346%23252%26ivf%3Dfalse%26keyword%3Dhp+murah%26search_id%3D202503010158437659E76192BAE0069WUB%26src%3Dsearch,Samsung Galaxy A31 6/128 GB-HP MURAH RAM BESAR-ANDROID MURAH,3650000.0,2.5,0,Laris Jaya Gadget86,Jakarta,"*barang dijamin 100% brand new in box + segel unit dan aksesoris *barang 100% original garansi uang kembali *garansi resmi samsung electronic indonesia *jaminan imei terdaftar di indonesia fitur product ukuran layar: 6.4 inci, 1080 x 2400 pixels, super amoled capacitive touchscreen, 16m colors memori: ram 6 gb, rom 128 gb, microsd up to 512 gb sistem operasi: android 10; one ui 2.0 cpu: octa-core (2x2.0 ghz & 6x1.7 ghz) kamera: quad 48 mp, f/2.0; 8 mp, f/2.2; 5 mp, f/2.4 & 5 mp, f/2.4, depan 20 mp, f/2.2 sim: dual sim (nano-sim) baterai: non-removable li-po 5000 mah berat: 185 gram",0.0,False,0.0,0.0,0.0,Samsung
https://www.tokopedia.com/amrumhirul/hp-samsung-galaxy-a03sa10s-7-0inci-waterdrop-ips-hd-4gb64gb-murah?extParam=fcity%3D174%2C175%2C176%2C177%2C178%2C179%23144%2C146%2C150%2C151%2C167%2C168%2C171%2C174%2C175%2C176%2C177%2C178%2C179%2C463%23165%2346%23252%26ivf%3Dfalse%26keyword%3Dhp+murah%26search_id%3D202503010158437659E76192BAE0069WUB%26src%3Dsearch,HP Samsung Galaxy A03sA10s 7.0inci Waterdrop IPS HD  4GB64GB Murah,1485100.0,2.5,0,Amrumhirul Shop,Surabaya,"samsung galaxy a03s  prosesor: menggabungkan kekuatan prosesor helio p35 dengan ram 4gb untuk performa lebih cepat dalam genggaman.  baterai 5000mah: baterai 5000mah memberi anda lebih banyak waktu untuk melakukan berbagai aktivitas favorit: streaming, sharing, gaming dan lainnya.  triple lens kamera: abadikan momen lebih detail dan jelas dengan 13mp kamera utama. seusuaikan fokus dengan deoth kamera, atau perjelas gambar lebih dekat dengan menggunakan macro kamera fingerprint sensor: terpasang tepat di tombol power, satu gerakan untuk mempermudah anda. sim: dual sim (nano-sim, dual stand-by) resolution: 720 x 1600 pixels, 20:9 ratio (~270 ppi density) os: android 11, one ui 3.1 core cpu: octa-core (4x2.35 ghz cortex-a53  amp; 4x1.8 ghz cortex-a53) gpu: powervr ge8320 card slot: microsdxc (dedicated slot) internal:  64gb 4gb ram emmc 5.1 triple: 13 mp, f/2.2, (wide), af, 2 mp, f/2.4, (macro) 2 mp, f/2.4, (depth) single5 mp, f/2.2 features: led flash video: 1080p@30fps battery type: li-po 5000 mah, non-removable charging: fast charging 15w wlan: wi-fi 802.11 b/g/n, wi-fi direct, hotspot bluetooth: 5.0, a2dp gps: yes, with a-gps, glonass, galileo, bds nfc: no radio: unspecified usb: usb type-c 2.0 dimensions: 164.2 x 75.9 x 9.1 mm (6.46 x 2.99 x 0.36 in) weight: 196 g (6.91 oz)  samsung a10s  parameter dasar jenis layar: layar penuh (layar tetesan air) os: android 9.0 fitur foto: fokus otomatis metode membuka kunci: pengenalan sidik jari belakang gt;  layar jenis layar sentuh: layar kapasitif, multi-sentuh ukuran layar utama: 6.2 inci bahan layar utama: bahan tft (teknologi ips) resolusi layar utama: 1520x720 piksel definisi normal 720p (mengalahkan 15,91% ponsel) kerapatan piksel layar: 393ppi bezel sempit: 2.63mm rasio layar: 75,97% layar penuh (layar tetesan air) (mengalahkan 22,71% ponsel)  perangkat keras frekuensi cpu: 1.6ghz jumlah inti: delapan inti kapasitas ram: 4gb   sku : 3131/1500508502323838976/55",0.0,False,0.0,0.0,0.0,Samsung
https://www.tokopedia.com/arindikristanti/produk-baru-hp-hp-a96-ram-12gb512gb-extended-rom-256gb-garansi-murah?extParam=fcity%3D174%2C175%2C176%2C177%2C178%2C179%23144%2C146%2C150%2C151%2C167%2C168%2C171%2C174%2C175%2C176%2C177%2C178%2C179%2C463%23165%2346%23252%26ivf%3Dfalse%26keyword%3Dhp+murah%26search_id%3D202503010158437659E76192BAE0069WUB%26src%3Dsearch,【Produk Baru HP】hp A96 RAM 12GB512GB ExtenDed ROM 256GB GARANSI Murah,1523300.0,2.5,0,Arindikristanti Shop,Surabaya,"a96 8gb+128gb garansi resmi original      selamat li digital 3c official  1.   bisa mendapatkan garansi satu bulan  2.   jaminan imei terdaftar di kemenperin 3.   jaminan harga termurah dari toko lain 4.   produk dijamin 100% original dan  baru 5.   garansi tukar unit jika produk yang diterima rusak/cacat  6.   garansi uang kembali jika produk hilang di ekspedisi selamat membeli kakak  deskripsi produk model: a96 platform: android 10.0 4g / 5g lte siaga: kartu ekspansi kartu tf vertikal dua lapis layar: 7,5 inci frekuensi: gsm: 800/900/1800/1900, wcdma: 850/2100 warna: hitam,kuning,biru memori: ram 12gb + rom 512gb kamera: 24mp + 58mp resolusi：1440*4000 multifungsi: pengenalan wajah, wifi mode tunggal, gps, sensor gravitasi, jam alarm, kalender, kalkulator, perekam audio, perekam video, wap/mms/gprs/, penampil gambar, tugas e-book, sampul iml bahasa: dukungan multi-bahasa baterai: baterai lithium-ion 5800mah li digital 3c official  di dalam kotak a96 dokumentasi kabel usb pengisi daya sim ejektor case pelindung lapisan pelindung layar    sku : 3131/1468255113997402112/55",0.0,False,0.0,0.0,0.0,OPPO
https://www.tokopedia.com/arabella-1/hp-murah-note-12-8256gb-7-5-fhd-true-color-amoled-display?extParam=fcity%3D174%2C175%2C176%2C177%2C178%2C179%23144%2C146%2C150%2C151%2C167%2C168%2C171%2C174%2C175%2C176%2C177%2C178%2C179%2C463%23165%2346%23252%26ivf%3Dfalse%26keyword%3Dhp+murah%26search_id%3D202503010158437659E76192BAE0069WUB%26src%3Dsearch,HP Murah Note 12 8256GB – 7.5 FHD True Color AMOLED Display –,1591300.0,2.5,0,"Arabella.,",Jakarta,"produk memiliki masa garansi  semua produk dalam stok  pengiriman: pesanan akan tiba dalam waktu 2-3hari  produk: pengerjaan halus, desain cantik  ikuti toko kami untuk mendapatkan voucher diskon serta update harga termurah dan barang baru  deskripsi produk model: note 12 pro platform: android 11.0 4g / 5g  siaga: kartu ekspansi kartu tf vertikal dua lapis layar: 7,5 inci frekuensi: gsm: 800/900/1800/1900, wcdma: 850/2100 warna: hitam,biru memori: ram 12gb + rom 512gb kamera: 24mp + 58mp resolusi：1440*3040 multifungsi: pengenalan wajah, wifi mode tunggal, gps, sensor gravitasi, jam alarm, kalender, kalkulator, perekam audio, perekam video, wap/mms/gprs/, penampil gambar, tugas e-book, sampul iml bahasa: dukungan multi-bahasa baterai: baterai lithium-ion 6800mah  isi kemasan: 1 x adaptor pengisi daya 1 x kabel pengisi daya 1 x headset 1 x panduan pengguna 1 x casing ponsel 1 x film pelindung  •melayani: 1. semua produk 100% baru 2. berkomitmen untuk menawarkan produk berkualitas tinggi dan harga yang wajar untuk anda. 3. setelah menerima barang, jika anda memiliki pertanyaan sendiri, silakan hubungi kami sesegera mungkin, sehingga kami dapat menyelesaikan masalah apa pun. •menjamin kami mengembalikan uang, mengirim ulang atau yang terbaik untuk produk apa pun untuk produk yang rusak atau cacat.  •tips： jika terjadi kesalahan manusia (user error), produk tidak dapat dikembalikan atau ditukar, contoh: - terkena cairan - segel rusak atau hilang - terbakar - terjatuh / gompal / lecet   sku : 3131/1469276224331661312/55",0.0,False,0.0,0.0,0.0,Xiaomi
https://www.tokopedia.com/cvmonamarket/baru-zte-blade-v50-8-128-garansi-resmi-hp-android-murah-zte-v50-diamond-black-8ddb7?extParam=fcity%3D174%2C175%2C176%2C177%2C178%2C179%23144%2C146%2C150%2C151%2C167%2C168%2C171%2C174%2C175%2C176%2C177%2C178%2C179%2C463%23165%2346%23252%26ivf%3Dfalse%26keyword%3Dhp+murah%26search_id%3D202503010158437659E76192BAE0069WUB%26src%3Dsearch,"[✅Baru] Zte Blade V50 8/128 Garansi Resmi, Hp Android Murah Zte V50",1964440.0,2.5,0,Cv Mona Market Id,Jakarta,"spesifikasi produk  layar : 6,6 inch fhd + large display, waterdrop internal memory : 128 gb ram memory : 8 gb + 8 gb kamera utama : 50 mp ai camera + 2mp depth camera + 4cm macro camera kamera depan : 8 mp platform : unisoc t606, octa-core 1.6ghz os: andriod 13 feature : wifi 2.4g/5g mimo1x1, hotspot, 802.11 a/b/g/n/ac,gps, bt5.2, accelerometer proximity, ambient light,side fingerprint volte   faq:  stok masih tersedia untuk pembelian.   sebelum dikirim, kami akan melakukan pengecekan menyeluruh untuk memastikan kualitas dan fungsionalitasnya terjamin. ok   jika terjadi kerusakan pada barang selama proses pengiriman, anda dapat mengajukan klaim dengan mengirimkan video unboxing yang menunjukkan barang dan penggunaannya secara lengkap.   selamat berbelanja terima kasih",0.0,False,0.0,0.0,0.0,ZTE
https://www.tokopedia.com/tokomyamandiri/hp-android-murah-vivo-ram-8gb-256gb-garansi-1-tahun?extParam=fcity%3D174%2C175%2C176%2C177%2C178%2C179%23144%2C146%2C150%2C151%2C167%2C168%2C171%2C174%2C175%2C176%2C177%2C178%2C179%2C463%23165%2346%23252%26ivf%3Dfalse%26keyword%3Dhp+murah%26search_id%3D202503010158437659E76192BAE0069WUB%26src%3Dsearch,HP Android Murah Vivo Ram 8GB/256GB Garansi 1 Tahun,1137000.0,2.5,0,Toko Mya Mandiri,Jakarta,"minimal pembelian ditoko kami senilai 30rb ,untuk produck bebas yg ada di etalase kami spesifikasi vivo y93 ram 8/256gb new garansi distributor : diumumkan	2018, december status	available. released 2018, december jaringan teknologi	gsm / cdma / hspa / lte 2g bands	gsm 850 / 900 / 1800 / 1900 - sim 1 & sim 2 cdma 800 & td-scdma - china 3g bands	hsdpa 850 / 900 / 2100 4g bands	1, 3, 5, 8, 34, 38, 39, 40, 41 kecepatan	hspa 42.2/5.76 mbps, lte cat5 150/75 mbps tubuh dimensi	155.1 x 75.1 x 8.3 mm (6.11 x 2.96 x 0.33 in) berat	165 g (5.82 oz) sim	dual sim (nano-sim, dual stand-by) menampilkan tipe	ips lcd ukuran	6.2 inches, 95.9 cm2 (~82.4% screen-to-body ratio) resolusi	720 x 1520 pixels, 19:9 ratio (~271 ppi density) penyimpanan slot kartu	microsdxc internal	128gb 4gb ram emmc 5.1 platform os	android 8.1 (oreo), funtouch 4.5 chipset	mediatek mt6762 helio p22 (12 nm) cpu	octa-core 2.0 ghz cortex-a53 gpu	powervr ge8320 kamera utama dual	13 mp, f/2.2, pdaf2 mp, f/2.4, (depth) features	led flash, panorama kamera selfie single	8 mp, f/2.0 video suara pemancar suara	yes 35mm jack	yes comms wi-fi	wi-fi 802.11 b/g/n, wi-fi direct, hotspot birutooth	4.2, a2dp, le gps	yes, with a-gps, glonass, bds nfc	no radio	fm radio usb	microusb 2.0, usb on-the-go fitur-fitur sensors	accelerometer, proximity, compass baterai tipe	li-po 4030 mah, non-removable nb : - mohon dibaca terlebih dahulu sebelum melakukan transaksi - review / comment negatif pada lapak garansi void / hangus !!! - anda sopan, kami segan !!!! - orderan jam 9 sampai jam 15.00 masuk pengiriman hari ini. ketentuan return barang : 1) garansi hanya berlaku jika segel masih utuh dan non human error 2) kami tidak akan proses return apabila ada vivo cloud di hp tersebut 3) ongkos kirim dan return sepenuhnya ditanggung oleh pembeli 5) mohon kirimkan video saat unboxing dan video kendala hp yang dialami 6) untuk kerusakan lcd dikenai biaya tambahan",0.0,False,0.0,0.0,0.0,VIVO
https://www.tokopedia.com/wakwawstoreid-1/ready-pengiriman-lokal-y27-handphone-android-4g-5g-58mp-7-5inci-12gb-512gb-garansi-resmi-gratis-ongkir-garasi-resmi-hp-murah-cuci-gudang-termurah-bisa-cicilan-gaming-phone-hp-t1-pro-5g-hp-y22-hp-y21-hp-v27e-hp-y36-1730844122637239702?extParam=fcity%3D174%2C175%2C176%2C177%2C178%2C179%23144%2C146%2C150%2C151%2C167%2C168%2C171%2C174%2C175%2C176%2C177%2C178%2C179%2C463%23165%2346%23252%26ivf%3Dfalse%26keyword%3Dhp+murah%26search_id%3D202503010158437659E76192BAE0069WUB%26src%3Dsearch,Ready 【Pengiriman Lokal+】Y27 Handphone Android 4G/5G 58Mp 7.5Inci 12Gb + 512Gb Garansi Resmi Gratis Ongkir Garasi Resmi Hp Murah Cuci Gudang Termurah Bisa Cicilan Gaming Phone | Hp T1 Pro 5G | Hp Y22 | Hp Y21 | Hp V27E | Hp Y36,1855000.0,2.5,0,Wakwawstoreid,Jakarta,"produk memiliki masa garansi semua produk dalam stok pengiriman: pesanan akan tiba dalam waktu 2-3hari produk: pengerjaan halus, desain cantik deskripsi produk model: y27   (versi peningkatan 5g) platform: android 12.0 pita frekuensi:2g/3g/4g/5g lte siaga: kartu ekspansi kartu tf vertikal dua lapis layar: 7.5 inci frekuensi: gsm: 800/900/1800/1900, wcdma: 850/2100 warna: hitam,sky blru kapasitas ram dan rom:  ram 12gb + 512gb kamera: 24mp+58mp resolusi：3040*1440 multifungsi:5g+,pengenalan wajah, wi-fi 6 (802.11ax), senter ponsel,gps, sensor gravitasi, jam alarm, kalender, kalkulator, perekam audio, perekam video, wap/mms/gprs/, penampil gambar, tugas e-book, sampul iml... bahasa: dukungan multi-bahasa baterai: baterai lithium-ion 6800mah di dalam kotak perangkat x 1 pengisi daya x 1 kabel data usb x 1 panduan pengguna x 1 case pelindung x 1 gratis 2 hadiah: headset x 1 film pelindung x 1 •melayani: 1. semua produk 100% baru •menjamin treasure bag mobile store kami mengembalikan uang, mengirim ulang atau yang terbaik untuk produk apa pun untuk produk yang rusak atau cacat. •tips： jika terjadi kesalahan manusia (user error), produk tidak dapat dikembalikan atau ditukar, contoh: - terkena cairan - segel rusak atau hilang - terbakar - terjatuh / gompal / lecet variasi: warna - hitam - sky blru rom+ram - 128gb - 256gb - 512gb",0.0,False,0.0,0.0,0.0,VIVO
https://www.tokopedia.com/jihanstore791/2023-produk-baru-hp-hp-galaxy-a32-ultra-handphone-android-4g5g-murah?extParam=fcity%3D174%2C175%2C176%2C177%2C178%2C179%23144%2C146%2C150%2C151%2C167%2C168%2C171%2C174%2C175%2C176%2C177%2C178%2C179%2C463%23165%2346%23252%26ivf%3Dfalse%26keyword%3Dhp+murah%26search_id%3D202503010158437659E76192BAE0069WUB%26src%3Dsearch,【2023 Produk Baru HP】hp Galaxy A32 Ultra Handphone android 4g5g Murah,1680000.0,2.5,0,Jihanstore791,Jakarta,"galaxy a32 12gb+512gb garansi resmi original      toko ponsel malaikat bayi  1.   bisa mendapatkan garansi satu bulan  2.   jaminan imei terdaftar di kemenperin 3.   jaminan harga termurah dari toko lain 4.   produk dijamin 100% original dan  baru 5.   garansi tukar unit jika produk yang diterima rusak/cacat  6.   garansi uang kembali jika produk hilang di ekspedisi selamat membeli kakak  deskripsi produk model: galaxy a32 platform: android 10.0 4g / 5g lte siaga: kartu ekspansi kartu tf vertikal dua lapis layar: 7,5 inci frekuensi: gsm: 800/900/1800/1900, wcdma: 850/2100 warna: hitam,kuning,biru memori: ram 12gb + rom 512gb kamera: 24mp + 58mp resolusi：1440*4000 multifungsi: pengenalan wajah, wifi mode tunggal, gps, sensor gravitasi, jam alarm, kalender, kalkulator, perekam audio, perekam video, wap/mms/gprs/, penampil gambar, tugas e-book, sampul iml bahasa: dukungan multi-bahasa baterai: baterai lithium-ion 5800mah toko ponsel malaikat bayi  di dalam kotak galaxy a32 dokumentasi kabel usb pengisi daya sim ejektor case pelindung lapisan pelindung layar    sku : 3131/1500512322491727872/55",0.0,False,0.0,0.0,0.0,Samsung
https://www.tokopedia.com/pstore-54/muarh-s22-ultra-16gb-512gb-hd-handphone-android-5g-murah-smartphone-hitam-128gb-f1482?extParam=fcity%3D174%2C175%2C176%2C177%2C178%2C179%23144%2C146%2C150%2C151%2C167%2C168%2C171%2C174%2C175%2C176%2C177%2C178%2C179%2C463%23165%2346%23252%26ivf%3Dfalse%26keyword%3Dhp+murah%26search_id%3D202503010158437659E76192BAE0069WUB%26src%3Dsearch,muarh S22 ultra 16GB+512GB HD Handphone android 5G  murah Smartphone,3328000.0,2.5,0,Puxa Store,Jakarta,"smartphone ini memiliki layar 7,5 inci. cukup lapang untuk mereka yang sering menonton live streaming. menjalankan sistem operasi android 12, ram 16gb, baterai 7000mah, data besar, dan daya tahan lebih lama. memiliki 5 kamera, kamera belakang 58 megapiksel dan kamera depan 24 megapiksel, yang terletak di tengah layar. mendukung face unlock dan auto beauty camera. terlebih dengan ram 16 gb, chipset spreadtrum cukup nyaman digunakan saat bermain game yang cukup berat seperti: - mobile legend - free fire dan juga lancar dalam menggunakan aplikasi sosial media. selain itu, sudah mendukung semua kartu sim dari provider yang ada di indonesia juga mendukung layanan 5g. deskripsi produk model:  ultra jenis prosesor:snapdragon 865 plus platform: android 12.0 pita frekuensi 3g/4g/5g lte siaga: kartu ekspansi kartu tf vertikal dua lapis layar: 7.5 inches hd+ frekuensi: gsm: 800/900/1800/1900, wcdma: 850/2100 warna: graphite，hijau，lime，merah jambu kapasitas ram dan rom:  ram 16gb  dan rom 512gb kamera: 32mp + 68mp resolusi：1660*4800 panel: layar kaku multifungsi:5g+,pengenalan wajah, wi-fi 6 (802.11ax), senter ponsel,gps, sensor gravitasi, jam alarm, kalender, kalkulator, perekam audio, perekam video, wap/mms/gprs/, penampil gambar, tugas e-book, sampul iml... bahasa: dukungan multi-bahasa baterai: baterai lithium-ion 7000mah •melayani: 1. semua produk 100% baru 2. berkomitmen untuk menawarkan produk berkualitas tinggi dan harga yang wajar untuk anda. 3. setelah menerima barang, jika anda memiliki pertanyaan sendiri, silakan hubungi kami sesegera mungkin, sehingga kami dapat menyelesaikan masalah apa pun. •menjamin treasure bag mobile store kami mengembalikan uang, mengirim ulang atau yang terbaik untuk produk apa pun untuk produk yang rusak atau cacat. •tips： jika terjadi kesalahan manusia (user error), produk tidak dapat dikembalikan atau ditukar, contoh: - terkena cairan - segel rusak atau hilang - terbakar - terjatuh / gompal",0.0,False,0.0,0.0,0.0,Samsung
https://www.tokopedia.com/bagusstoreidn/hp-y17-ram8-256gb-6-35-inch-hp-smartphone-bisa-cod-hp-murah-1730859355130070032?extParam=fcity%3D174%2C175%2C176%2C177%2C178%2C179%23144%2C146%2C150%2C151%2C167%2C168%2C171%2C174%2C175%2C176%2C177%2C178%2C179%2C463%23165%2346%23252%26ivf%3Dfalse%26keyword%3Dhp+murah%26search_id%3D202503010158437659E76192BAE0069WUB%26src%3Dsearch,HP Y17 ram8 256GB 6.35-inch hp smartphone bisa cod hp murah,2961000.0,2.5,0,Bagus Store Idn,Jakarta,"ready stok ya kak. silahkan diorder kak ^_^ hp y17  8/256 network :gsm / hspa / lte launch: announced	2019, april status: available. released 2019, april body: dimensions	159.4 x 76.8 x 8.9 mm (6.28 x 3.02 x 0.35 in) weight:	190.5 g (6.74 oz) build: glass front, plastic back, plastic frame sim	single sim (nano-sim) or dual sim (nano-sim, dual stand-by) display type: ips lcd size: 6.35 inches, 99.6 cm2 (~81.4% screen-to-body ratio) resolution: 720 x 1544 pixels (~268 ppi density) platform: os	android 9.0 (pie), funtouch 9 chipset :mediatek mt6765 helio p35 (12nm) cpu: octa-core (4x2.3 ghz cortex-a53 & 4x1.8 ghz cortex-a53) gpu: powervr ge8320 memory card slot microsdxc (dedicated slot) internal	8gb ram 256gb memory main camera: triple	13 mp, f/2.2, pdaf 8 mp, f/2.2, 16mm (ultrawide) 2 mp, f/2.4, (depth) features	led flash, hdr, panorama selfie camera	single: 20 mp, f/2.0, (wide), 1/2.8"", 1.0µm - global 16 mp, f/2.0, 26mm (wide), 1/3.06"", 1.0µm - china sound:	loudspeaker	yes 3.5mm jack:	yes comms	wlan	wi-fi 802.11 b/g/n, wi-fi direct, hotspot bluetooth	5.0, a2dp, le gps:	yes, with a-gps, glonass, galileo, bds nfc:	no radio:	fm radio usb:	microusb 2.0, usb on-the-go features:	sensors	fingerprint (rear-mounted), accelerometer, proximity, compass berkualitas dijamin peking aman sampai tujuan dan rapi",0.0,False,0.0,0.0,0.0,VIVO
https://www.tokopedia.com/meditabungatesia/0k77-flash-sales-produk-baru-hp-gala-s23-ultra-hp-murah-model?extParam=fcity%3D174%2C175%2C176%2C177%2C178%2C179%23144%2C146%2C150%2C151%2C167%2C168%2C171%2C174%2C175%2C176%2C177%2C178%2C179%2C463%23165%2346%23252%26ivf%3Dfalse%26keyword%3Dhp+murah%26search_id%3D202503010158437659E76192BAE0069WUB%26src%3Dsearch,0k77 【Flash Sales】Produk Baru HP Gala S23 ultra HP Murah Model,1320000.0,2.5,0,Meditabungatesia,Jakarta,"semua produk sedang dalam promosi sekarang. jika berminat, bisa bertanya ke bagian customer service department.  welcome !   produk memiliki masa garansi 6 bulan pengiriman：pesanan akan tiba dalam waktu 2-3hari   produk：pengerjaan halus, desain cantik menjamin：terbaik store-5g handphone amp;tab kami mengembalikan uang, mengirim ulang atau yang terbaik untuk produk apa pun untuk produk yang rusak atau cacat.  semua produk dalam stok  garansi uang kembali jika produk hilang di ekspedisi  ikuti toko kami untuk mendapatkan voucher diskon serta update harga termurah dan barang baru  1. nomor model: s23 ultra  2. platform: mtk6889 3. getaran: dukungan 4. warna: hitam/hijau/biru/kuning/merah muda 5. speaker: 1511 kotak speaker 6. kekerapan: gsm850/900/1800/1900mhz, 3g: wcdma850/1900/2100mhz, 4g lte 5g 7. memori: ram 16gb + rom 512gb 8. siaga: kartu sim ganda ganda (slot mendukung kartu sim, slot lain mendukung kartu sim atau kartu tf) 9. layar: 7.5 hd + tampilan penuh 1080 * 2320 10. multimedia: mp3 / mp4 / 3gp / radio fm / bluetooth 11. kamera: 24mp + 48mp 12. multi-fungsi: layar penuh, pengenalan wajah, dual sim, wifi, gps, sensor gravitasi, jam alarm, kalender, kalkulator, perekam suara, perekam video, wap / mms / gpr, program image viewer, e-book, jam dunia, kartu flash kembali, penutup belakang iml 13. bahasa: mendukung banyak bahasa14. lainnya: sistem android os 11.0 14. baterai: li-ion 7000mah  multifungsi:5g+,pengenalan wajah, wi-fi 6 (802.11ax), senter ponsel,gps, sensor gravitasi, jam alarm, kalender, kalkulator, perekam audio, perekam video, wap/mms/gprs/, penampil gambar, tugas e-book, sampul iml... bahasa: dukungan multi-bahasa baterai: baterai lithium-ion 6800mah aksesoris: charger standar, kabel data, earphone, lengan karet, film pelindung, manual.  isi paket: 1xperangkat  1xpengisi daya  1x kabel data usb 1 xpanduan pengguna 1x headset   gratis 2 hadiah: 1x case pelindung 1xfilm pelindung  •melayani: 1. semua produk 100% baru 2. berkomitmen untuk",0.0,False,0.0,0.0,0.0,Samsung
https://www.tokopedia.com/wakwawstoreid-1/murah-garansi-resmi-handphone-c55-hp-murah-7-5inci-hp-baru-smartphone-android13-original-ori-cuci-gudang-2024-handphone16gb-512gb-wifi-4g-5g-hp-murah-hd-handphone-hp-tebaru-dual-card-sim-7000mah-1730844072312866198?extParam=fcity%3D174%2C175%2C176%2C177%2C178%2C179%23144%2C146%2C150%2C151%2C167%2C168%2C171%2C174%2C175%2C176%2C177%2C178%2C179%2C463%23165%2346%23252%26ivf%3Dfalse%26keyword%3Dhp+murah%26search_id%3D202503010158437659E76192BAE0069WUB%26src%3Dsearch,Murah 【Garansi Resmi】Handphone C55 Hp Murah 7.5Inci Hp Baru Smartphone Android13 Original Ori Cuci Gudang 2024 Handphone16Gb+512Gb Wifi 4G/5G Hp Murah Hd Handphone Hp Tebaru Dual Card Sim 7000Mah,1622000.0,2.5,0,Wakwawstoreid,Jakarta,"deskripsi produk model: c55 platform: android 12.0 4g / 5g lte siaga: kartu ekspansi kartu tf vertikal dua lapis layar: 7,5 inci frekuensi: gsm: 800/900/1800/1900, wcdma: 850/2100 warna: hitam,biru,putih memori: ram 16gb + rom 512gb resolusi：1440*3040 multifungsi: pengenalan wajah, wifi mode tunggal, gps, sensor gravitasi, jam alarm, kalender, kalkulator, perekam audio, perekam video, wap/mms/gprs/, penampil gambar, tugas e-book, sampul iml bahasa: dukungan multi-bahasa isi kemasan: 1 x adaptor pengisi daya 1 x kabel pengisi daya 1 x headset 1 x panduan pengguna 1 x casing ponsel 1 x film pelindung •melayani: 1. semua produk 100% baru •menjamin kami mengembalikan uang, mengirim ulang atau yang terbaik untuk produk apa pun untuk produk yang rusak atau caca variasi: color - hitam - emas - hijau - hitam- rom - 128gb - 256gb - 512gb - 64gb",0.0,False,0.0,0.0,0.0,Realme
