link,name,price,rating,total_sold,store_name,store_location,product_description,customer_satisfaction,IsRated,total_rating,num_reviews,review_rating_ratio,brand_name
https://www.tokopedia.com/wakwawstoreid-1/murah-2024-new-bisa-v29-16-512gb-hd-handphone-android-5g-hp-murah-smartphone-7000-mah-dual-card-sim-garansi-resmi-ponsel-pintar-baru-cuci-gudang-termurah-cicilan-gaming-phone-v25e-1730844129543423382?extParam=fcity%3D174%2C175%2C176%2C177%2C178%2C179%23144%2C146%2C150%2C151%2C167%2C168%2C171%2C174%2C175%2C176%2C177%2C178%2C179%2C463%23165%2346%23252%26ivf%3Dfalse%26keyword%3Dhp+murah%26search_id%3D202503010158437659E76192BAE0069WUB%26src%3Dsearch,Murah 【2024 New Bisa 】V29 16+512Gb Hd Handphone Android 5G Hp Murah Smartphone 7000 Mah Dual Card Sim Garansi Resmi Ponsel Pintar Baru Cuci Gudang Termurah Cicilan Gaming Phone V25E,1834000.0,2.5,0,Wakwawstoreid,Jakarta,"welcome ! produk memiliki masa garansi semua produk dalam stok pengiriman: pesanan akan tiba dalam waktu 2-3hari produk: pengerjaan halus, desain cantik menjamin： kami mengembalikan uang, mengirim ulang atau yang terbaik untuk produk apa pun untuk produk yang rusak atau cacat. v29 (versi peningkatan 5g), smartphone ini memiliki layar 7,5 inci. cukup lapang untuk mereka yang sering menonton live streaming. terlebih dengan ram 16 gb, chipset spreadtrum cukup nyaman digunakan saat bermain game yang cukup berat seperti: - mobile legend - free fire dan juga lancar dalam menggunakan aplikasi sosial media. selain itu, sudah mendukung semua kartu sim dari provider yang ada di indonesia juga mendukung layanan 5g. deskripsi produk model: v29 platform : snapdragon 8 gen 2 platform: android 12.0 pita frekuensi 3g/4g/5g lte siaga: kartu ekspansi kartu tf vertikal dua lapis layar: 7.5 inches hd+ frekuensi: gsm: 800/900/1800/1900, wcdma: 850/2100 warna: graphite，hijau，lime，merah jambu kapasitas ram dan rom:  ram 16gb  dan rom 512gb kamera: 32mp + 68mp panel: layar kaku multifungsi:5g+,pengenalan wajah, wi-fi 6 (802.11ax), senter ponsel,gps, sensor gravitasi, jam alarm, kalender, kalkulator, perekam audio, perekam video, wap/mms/gprs/, penampil gambar, tugas e-book, sampul iml... bahasa: dukungan multi-bahasa di dalam kotak 1xperangkat 1xpengisi daya 1x kabel data usb 1 xpanduan pengguna 1x headset gratis 2 hadiah: 1x case pelindung 1xfilm pelindung •melayani: 1. semua produk 100% baru •menjamin treasure bag mobile store kami mengembalikan uang, mengirim ulang atau yang terbaik untuk produk apa pun untuk produk yang rusak atau cacat. •tips： jika terjadi kesalahan manusia (user error), produk tidak dapat dikembalikan atau ditukar, contoh: - terkena cairan - segel rusak atau hilang - terbakar - terjatuh / gompal / lecet #gaming phone hp murah #ponsel pintar baru #siswa belajar ponsel #5g variasi: warna - hitam - red - blue - hitam-- rom - 128gb - 256gb - 512gb",0.0,False,0.0,0.0,0.0,VIVO
https://www.tokopedia.com/amazonegadget/promo-nokia-8850-masterpiece-gold-nokia-jadul-ori-hp-jadul-murah?extParam=fcity%3D174%2C175%2C176%2C177%2C178%2C179%23144%2C146%2C150%2C151%2C167%2C168%2C171%2C174%2C175%2C176%2C177%2C178%2C179%2C463%23165%2346%23252%26ivf%3Dfalse%26keyword%3Dhp+murah%26search_id%3D202503010158437659E76192BAE0069WUB%26src%3Dsearch,[Promo] Nokia 8850 Masterpiece Gold | Nokia Jadul ORI | HP Jadul Murah,1699000.0,2.5,0,Amazone Gadget,Jakarta,"penawaran terbaik dengan harga bersaing!  ------------------------------------------------------------------------------  kondisi:  - warna: gold  - mulusss 99%  - fullset buku dus (travel charger, buku manual, 1 unit batere)  barang dijamin nokia asli 100% dan sesuai foto di lapak    network technology   gsm  launch announced 1999  status discontinued  body dimensions 100 x 44 x 17 mm, 70 cc (3.94 x 1.73 x 0.67 in)  weight 91 g (3.21 oz)  sim mini-sim  display type monochrome graphic  size   resolution 5 lines  - dynamic font size   - softkey  memory card slot no  phonebook 250  call records yes  - memory for 8 voice dialnumbers- 50 calendar notes  camera no  sound alert types vibration; downloadable monophonic ringtones  loudspeaker no  3.5mm jack no  - space for 5 received ringing tones  comms wlan no  bluetooth no  gps no  infrared port yes  radio no  usb   features messaging sms  browser   clock yes  alarm yes  games 3  languages 32 total  java no  - picture messaging  - predictive text input  - smart messaging  - organizer  - infrared transfer of names and phone numbers  battery removable li-ion 830 mah battery (blb-2)  stand-by 50 - 150 h  talk time 2 h - 3 h 20 min  misc colors metallic  sar eu 0.43 w/kg (head)  ----------------------------------------  thank you   happy shopping,  amazone gadget  ----------------------------------------",0.0,False,0.0,0.0,0.0,Nokia
https://www.tokopedia.com/selaluadanih/itel-rs4-12gb-256gb-12-256-8-128-baru-new-original-resmi-hp-game-murah-12-256gb-white-99a67?extParam=fcity%3D174%2C175%2C176%2C177%2C178%2C179%23144%2C146%2C150%2C151%2C167%2C168%2C171%2C174%2C175%2C176%2C177%2C178%2C179%2C463%23165%2346%23252%26ivf%3Dfalse%26keyword%3Dhp+murah%26search_id%3D20250301042531E7F72256397B2D1A4E75%26src%3Dsearch,ITEL RS4  12gb/256gb 12/256 8/128 Baru new Original Resmi HP game murah,2095000.0,2.5,0,Selaluadanih,Jakarta,"cicilan mudah dengan atau tanpa kartu kredit, proses mudah hanya 3 menit penting.!! *barang dijamin 100% brand new in box + segel unit dan aksesoris *barang 100% original garansi uang kembali *garansi resmi itel indonesia 1 tahun *jaminan imei terdaftar di indonesia",0.0,False,0.0,0.0,0.0,ITEL
https://www.tokopedia.com/kalolakuaja/infinix-note-40-pro-8gb-256gb-8-256-baru-new-resmi-hp-gaming-murah-nfc-gold-7609e?extParam=fcity%3D174%2C175%2C176%2C177%2C178%2C179%23144%2C146%2C150%2C151%2C167%2C168%2C171%2C174%2C175%2C176%2C177%2C178%2C179%2C463%23165%2346%23252%26ivf%3Dfalse%26keyword%3Dhp+murah%26search_id%3D202503010158437659E76192BAE0069WUB%26src%3Dsearch,Infinix NOTE 40 PRO 8gb/256gb 8/256 baru new Resmi hp gaming murah nfc,3295000.0,2.5,0,Kalolakuaja,Jakarta,"cicilan mudah dengan atau tanpa kartu kredit, proses mudah hanya 3 menit penting.!! *barang dijamin 100% brand new in box + segel unit dan aksesoris *barang 100% original garansi uang kembali *garansi resmi infinix indonesia 1 tahun *jaminan imei terdaftar di indonesia",0.0,False,0.0,0.0,0.0,Infinix
https://www.tokopedia.com/msh-29/bisa-cod-hp-murah-sumsumg-s23-ultra-5g-7-8inci-ponsel-jaminan-murah?extParam=fcity%3D174%2C175%2C176%2C177%2C178%2C179%23144%2C146%2C150%2C151%2C167%2C168%2C171%2C174%2C175%2C176%2C177%2C178%2C179%2C463%23165%2346%23252%26ivf%3Dfalse%26keyword%3Dhp+murah%26search_id%3D20250301042531E7F72256397B2D1A4E75%26src%3Dsearch,【 Bisa COD】hp murah sumsumg S23 ultra 5G 7.8Inci Ponsel Jaminan Murah,1288000.0,2.5,0,Merlinalfiyanah Shop,Jakarta,"q: apakah ini mendukung pengiriman uang (cod)? a: ya, kami mendukung transfer tunai.  q: apakah barang dijamin? a: ya, jika ada masalah dengan verifikasi, kami memberikan layanan kompensasi dan pengembalian.  ketentuan pengembalian: - garansi hanya berlaku jika segel masih utuh dan tidak ada human error - ongkos kirim dan retur sepenuhnya ditanggung pembeli - barang yang dikembalikan harus tidak rusak dan disegel  melihat: - order masuk jam 00:00 s/d 18:00 pengiriman di hari yang sama..  setelah itu akan dikirim keesokan harinya mungkin akan tiba dalam waktu sekitar 1-3 hari. it may arrive in about 1-3 days.  specification: 1.model no.:s23 ultra 2.platform : qualcomm 888+ 3.standby: dual sim dual standby(a slot support sim card, another slot support sim card or tf card) 4.screen: 7.3 hd+ full display 1080x2320 5.speaker: 1511 box speaker 6.frequency: gsm850, 3g: wcdma2100mhz，5g lte  5g7.vibration: support 8.colors:   black/gold/light blue/green/purple 9.memory: 12gb ram+128 rom 10.multi media: mp3/mp4/3gp/fm radio/bluetooth 11.camera: 48mp+72mp 12.multi function: full screen, face recognition, dual sim, wifi, gps, gravity sensor, alarm ,calendar ,calculator ,audio recorder ,video recorder, wap/mms/gpr, image viewer,e-book,world clock,tasks card rear flash iml rear cover 13.languages: multi-language support 14.others: android os 12.0 system 15.battery:8000mah lithium-ion battery 16.type-c plug 17.ultra unibody  package included: 1 x smartphone, 1 x charger adapter, 1 x headphones, 1 x user manual 1 x phone case 1 x protection film   sku : 3131/1522918769313660928/55",0.0,False,0.0,0.0,0.0,Samsung
https://www.tokopedia.com/rsanjaya-6/ready-new-arrival-hp-murah-v29-handphone-asli-16gb-ram-512gb-rom-hd?extParam=fcity%3D174%2C175%2C176%2C177%2C178%2C179%23144%2C146%2C150%2C151%2C167%2C168%2C171%2C174%2C175%2C176%2C177%2C178%2C179%2C463%23165%2346%23252%26ivf%3Dfalse%26keyword%3Dhp+murah%26search_id%3D202503010158437659E76192BAE0069WUB%26src%3Dsearch,Ready [NEW ARRIVAL] hp murah V29 Handphone Asli 16GB RAM+512GB ROM HD,2730000.0,2.5,0,Robotek Sanjaya,Jakarta,"ready selamat datang di dolphin digital  produk memiliki masa garansi  semua produk dalam stok  pengiriman: pesanan akan tiba dalam waktu 2-3hari  produk: pengerjaan halus, desain cantik  deskripsi produk model: v29(versi peningkatan 5g) platform: android 12.0  pita frekuensi:2g+3g+4g+5g lte siaga: kartu ekspansi kartu tf vertikal dua lapis layar: 7.5 inci frekuensi: gsm: 800/900/1800/1900, wcdma: 850/2100 warna: velvet red,peak blue,noble black kapasitas ram dan rom:  ram 16gb + 512gb kamera: 32mp + 68mp resolusi：1440*3040 panel: layar kaku multifungsi:5g+,pengenalan wajah, wi-fi 6 (802.11ax), senter ponsel,gps, sensor gravitasi, jam alarm, kalender, kalkulator, perekam audio, perekam video, wap/mms/gprs/, penampil gambar, tugas e-book, sampul iml... bahasa: dukungan multi-bahasa  di dalam kotak  perangkat x 1  pengisi daya x 1  kabel data usb x 1  panduan pengguna x 1  case pelindung x 1   gratis 2 hadiah:  headset x 1  film pelindung x 1  •melayani: 1. semua produk 100% baru •menjamin (dolphin digital) kami mengembalikan uang, mengirim ulang atau yang terbaik untuk produk apa pun untuk produk yang rusak atau cacat.  •tips： jika terjadi kesalahan manusia (user error), produk tidak dapat dikembalikan atau ditukar, contoh: - terkena cairan - segel rusak atau hilang - terbakar - terjatuh / gompal / lecet",0.0,False,0.0,0.0,0.0,VIVO
https://www.tokopedia.com/galaxycare/ponsel-android-pintar-hp-opp0-reno9-pro-4g-5g-asli-baru-16gb-512gb-ram-7-5-inci-6800mah-komputer-murah-untuk-dipelajari-siswa-jaminan-keaslian-resmi-32mp-64mp-hd-kamera-obralan-smartphone-murah-terlaris-cod-hitam-6-3inch-128gb-80f46?extParam=fcity%3D174%2C175%2C176%2C177%2C178%2C179%23144%2C146%2C150%2C151%2C167%2C168%2C171%2C174%2C175%2C176%2C177%2C178%2C179%2C463%23165%2346%23252%26ivf%3Dfalse%26keyword%3Dhp+murah%26search_id%3D20250301042531E7F72256397B2D1A4E75%26src%3Dsearch,"Ponsel Android pintar hp OPP0 Reno9 Pro 4G/5G asli baru 16GB+512GB RAM 7,5 inci 6800mAh komputer murah untuk dipelajari siswa jaminan keaslian resmi 32MP+64MP HD kamera obralan smartphone murah terlaris COD",1679000.0,2.5,0,Galaxy Care,Jakarta,"1.model: oppo reno9 pro 2. peron: mtk6889 3. siaga: kartu sim ganda (satu slot mendukung kartu sim, slot lainnya mendukung kartu sim atau kartu tf) 4. warna: ungu/hitam/biru 6. pembicara: 1511 pembicara 7. frekuensi: gsm850/900/1800/1900mhz, 3g: wcdma850/1900/2100mhz, 4g lte 5g 8. getaran: dukungan 9. memori: ram 16gb + rom 512gb 10. multimedia: radio mp3/mp4/3gp/fm/bluetooth 11.kamera: 24mp+48mp 12. multi-fungsi: layar penuh, pengenalan wajah, sim ganda, wifi, gps, sensor gravitasi, jam alarm, kalender, kalkulator, perekam audio, perekam video, wap/mms/gpr, program, tampilan gambar, e-book, jam dunia, flash kartu sampul belakang iml. 13. bahasa: mendukung berbagai bahasa 14. lainnya: sistem android os 12.0 15. baterai: baterai lithium-ion 6800mah 16. pengaturan produk gratis ● 1.model: oppo reno9 pro ● 2. slot kartu: kartu ganda dual standby (satu slot kartu mendukung kartu sim, slot kartu lainnya mendukung kartu sim atau kartu tf) ● 3. layar: 7,5 inci ● 4. jaringan: mendukung 3g/4g/5g ● 5. getaran: dukungan ● 6. buka kunci: sidik jari, layar pengenalan wajah ● 7. warna: hitam, ungu, biru ● 8. memori: ram12gb+rom512gb ● 9. multimedia: radio mp3/mp4/3gp/fm/bluetooth ● 10.kamera: 24mp+58mp ● 11. multi-fungsi: layar penuh, pengenalan wajah, dual sim, wifi, gps, sensor gravitasi, jam alarm, kalender, kalkulator, perekam video, wap/mms/gpr, penampil gambar, e-book, jam dunia, kembali sampul, pelabelan dalam cetakan iml ● 12. bahasa: mendukung bahasa indonesia, inggris, cina, prancis, rusia, dll. ● 13. baterai: baterai lithium-ion 6800mah",0.0,False,0.0,0.0,0.0,OPPO
https://www.tokopedia.com/elijahretania/hp-galaxy-a23-handphone-android-12gb-512gb-handphone-murah-garansi-resmi-sein-snapdragon-handphone-amoled-7-5-inci?extParam=fcity%3D174%2C175%2C176%2C177%2C178%2C179%23144%2C146%2C150%2C151%2C167%2C168%2C171%2C174%2C175%2C176%2C177%2C178%2C179%2C463%23165%2346%23252%26ivf%3Dfalse%26keyword%3Dhp+murah%26search_id%3D202503010158437659E76192BAE0069WUB%26src%3Dsearch,"HP Galaxy A23 Handphone Android 12GB+512GB Handphone Murah Garansi Resmi Sein Snapdragon Handphone AMOLED 7,5 inci",1460000.0,2.5,0,Elijahretania Shop,Jakarta,"product description： semua produk dalam stok  produk memiliki masa garansi  pengiriman: pesanan akan tiba dalam waktu 2-3hari  produk: pengerjaan halus, desain cantik  ikuti toko kami untuk mendapatkan voucher diskon serta update harga termurah dan barang baru  deskripsi produk: model: galaxy a23 5g os : android 12, one ui 4.1 chipset : qualcomm sm6225 snapdragon 865 plus 4g (6 nm) cpu : octa-core (4x2.4 ghz kryo 265 gold  amp; 4x1.9 ghz kryo 265 silver) gpu : adreno 610 size : 7.5” technology : pls lcd resolution : fhd+ rear camera resolution : 24+58 mp main camera auto focus : yes rear camera - ois : yes rear camera - zoom : digital zoom up to 10x front camera resolution : 8.0 mp front camera auto focus : no video resolution : fhd (1920 x 1080) @30fps ram : 12gb rom : 512gb sim tray : dual-sim network type : 4g 5g usb interface : usb type-c usb version : usb 2.0 earjack : 3.5mm stereo bluetooth version : bluetooth v5.0 nfc : yes battery capacity : 6800mah  isi kemasan: 1 x adaptor pengisi daya 1 x kabel pengisi daya 1 x headset 1 x panduan pengguna 1 x casing ponsel 1 x film pelindung",0.0,False,0.0,0.0,0.0,Samsung
https://www.tokopedia.com/faneswandin/bisa-cod-handphone-vv0-v27e-hp-murah-android-cuci-gudang-gaming?extParam=fcity%3D174%2C175%2C176%2C177%2C178%2C179%23144%2C146%2C150%2C151%2C167%2C168%2C171%2C174%2C175%2C176%2C177%2C178%2C179%2C463%23165%2346%23252%26ivf%3Dfalse%26keyword%3Dhp+murah%26search_id%3D202503010158437659E76192BAE0069WUB%26src%3Dsearch,【Bisa COD】handphone  VV0 V27e hp murah Android cuci gudang Gaming,3269000.0,2.5,0,Faneswandin Shop,Surabaya,"welcome !   produk memiliki masa garansi 6 bulan pengiriman：pesanan akan tiba dalam waktu 2-3hari   produk：pengerjaan halus, desain cantik menjamin：terbaik store-5g handphone amp;tab kami mengembalikan uang, mengirim ulang atau yang terbaik untuk produk apa pun untuk produk yang rusak atau cacat.  semua produk dalam stok  garansi uang kembali jika produk hilang di ekspedisi  ikuti toko kami untuk mendapatkan voucher diskon serta update harga termurah dan barang baru  galaxy v27e, smartphone ini memiliki layar 7,5 inci. cukup lapang untuk mereka yang sering menonton live streaming. menjalankan sistem operasi android 12, ram 12gb, baterai 6800mah, data besar, dan daya tahan lebih lama. memiliki 3 kamera, kamera belakang 68 megapiksel dan kamera depan 32 megapiksel, yang terletak di tengah layar. mendukung face unlock dan auto beauty camera. terlebih dengan ram 12 gb, chipset spreadtrum cukup nyaman digunakan saat bermain game yang cukup berat seperti: - mobile legend - free fire dan juga lancar dalam menggunakan aplikasi sosial media. selain itu, sudah mendukung semua kartu sim dari provider yang ada di indonesia juga mendukung layanan 4g/5g.  deskripsi produk model: v27e jenis prosesor:qualcomm 888+ platform: android 12.0  pita frekuensi 3g/4g/5g lte siaga: kartu ekspansi kartu tf vertikal dua lapis layar: 7.5 inches hd+ frekuensi: gsm: 800/900/1800/1900, wcdma: 850/2100 warna: graphite，hijau，lime，merah jambu kapasitas ram dan rom:  ram 12gb  dan rom 512gb kamera: 48mp + 72mp resolusi：1080x2320 panel: layar kaku  multifungsi:5g+,pengenalan wajah, wi-fi 6 (802.11ax), senter ponsel,gps, sensor gravitasi, jam alarm, kalender, kalkulator, perekam audio, perekam video, wap/mms/gprs/, penampil gambar, tugas e-book, sampul iml... bahasa: dukungan multi-bahasa baterai: baterai lithium-ion 6800mah aksesoris: charger standar, kabel data, earphone, lengan karet, film p  sku : 3131/1530441362908332032/55",0.0,False,0.0,0.0,0.0,Samsung
https://www.tokopedia.com/duliyoo/tecno-pova-5-second-8-256-gb-hp-second-hp-seken-hp-bekas-hp-murah-1730935203132966337?extParam=fcity%3D174%2C175%2C176%2C177%2C178%2C179%23144%2C146%2C150%2C151%2C167%2C168%2C171%2C174%2C175%2C176%2C177%2C178%2C179%2C463%23165%2346%23252%26ivf%3Dfalse%26keyword%3Dhp+murah%26search_id%3D202503010158437659E76192BAE0069WUB%26src%3Dsearch,TECNO POVA 5 SECOND 8/256 GB HP SECOND HP SEKEN HP BEKAS HP MURAH,2111000.0,2.5,0,Mania Phone,Jakarta,"selamat datang di mc.store selamat belanja :) [ perhatian ! ] ° baca deskripsi dahulu sebelum membeli, agar tidak ada kesalahpahan antar penjual dan pembeli ° untuk  kami kirim sesuai stok yang tersedia atau chat terlebih dahulu untuk menanyakan  yang tersedia ° tersedia bubble warp tambahan ada di etalase toko, agar barang lebih aman. ° detail produk : - kelengkapan : fullset & hp aja - fungsi : normal - spek singkat • layar : 6.78 inches • chipset : mediatek helio g99 (6 nm) • ram, internal : 8gb ram, 256gb • kamera depan : 5 mp • kamera belakang : 50mp tanpa bukti yg jelas proses garansi hangus. note!! : untuk retur harus berupa bukti yg valid, syarat dan ketentuanya sebagai berikut : - memberikan rating / feedback buruk tanpa berdiskusi terlebih dahulu tidak kami layani - segel tidak rusak - video unboxing paket - ongkos retur di tanggung pembeli ° jadwal pengiriman : - senin - sabtu maksimal jam 17.00 wib - minggu maksimal jam 16.30 wib note!! : khusus hari minggu gunakan jasa pengiriman j&t, selain itu jasa pengiriman yang lain libur jika ada kendala pengiriman maka akan ada info lebih lanjut pahami dan baca dengan baik sebelum membeli produk agar tidak ada kesalah pahaman. terimakasih telah berkunjung. #hpmurah #androidmurah #hpseken #androidseken #hp #android",0.0,False,0.0,0.0,0.0,TECNO
https://www.tokopedia.com/duliyoo/hp-murah-redmi-6-pro-ram-4gb-internal-64gb-ori-second-1730936279551608257?extParam=fcity%3D174%2C175%2C176%2C177%2C178%2C179%23144%2C146%2C150%2C151%2C167%2C168%2C171%2C174%2C175%2C176%2C177%2C178%2C179%2C463%23165%2346%23252%26ivf%3Dfalse%26keyword%3Dhp+murah%26search_id%3D202503010158437659E76192BAE0069WUB%26src%3Dsearch,HP MURAH REDMI 6 PRO RAM 4GB INTERNAL 64GB ORI SECOND,1163000.0,2.5,0,Mania Phone,Jakarta,xiaomi redmi 6pro ram 4gb internal 64gb hape original second no rekondisi/refub hape +charger (no box) jaringan aman siap pakai mesin normal lancar kondisi mulus pemakaian wajar 85-90% warna di kirim random terbaik bila pilih wrna gak bsa pilih fisik,0.0,False,0.0,0.0,0.0,Xiaomi
https://www.tokopedia.com/ocup-grosir55/infinix-hot-11-s-nfc-4-64-gb-handphone-4g-murah-hp-android-4g-murah-terlaris-termurah-bergaransi-dapatkan-sekarang-1730936274609276167?extParam=fcity%3D174%2C175%2C176%2C177%2C178%2C179%23144%2C146%2C150%2C151%2C167%2C168%2C171%2C174%2C175%2C176%2C177%2C178%2C179%2C463%23165%2346%23252%26ivf%3Dfalse%26keyword%3Dhp+murah%26search_id%3D202503010158437659E76192BAE0069WUB%26src%3Dsearch,"Infinix Hot 11 S Nfc 4/64 Gb Handphone 4G Murah Hp Android 4G Murah Terlaris,Termurah,Bergaransi,Dapatkan Sekarang",2320000.0,2.5,0,Ocup Grosir55,Bekasi,"bismillahirrahmanirrahim selamat datang ditoko kami silahkan yang  mau berbelanja beli sekarang nikmati selamanya ready stok yaa wah mantap guys! smartphone android 4g yang stylish modis dan trendy abis. kenceng internetnya kece modelnya dan keren kamera selfie-nya. infinix hot 11 s nfc note:komplain tanpa vidio unboxing tidak diterima, gudang ada di beberapa tempat jadi pengiriman tidak sealu sesuai dengan alamat toko noted : barang yang dikirim bersegel dan baru beli = setuju !",0.0,False,0.0,0.0,0.0,Infinix
https://www.tokopedia.com/banjollcyzh/murah-vivo-v23e-8-128-ram-8-rom-128gb-handphone-smartphone-android-gadget-elegan-1730891825063298553?extParam=fcity%3D174%2C175%2C176%2C177%2C178%2C179%23144%2C146%2C150%2C151%2C167%2C168%2C171%2C174%2C175%2C176%2C177%2C178%2C179%2C463%23165%2346%23252%26ivf%3Dfalse%26keyword%3Dhp+murah%26search_id%3D202503010158437659E76192BAE0069WUB%26src%3Dsearch,Murah Vivo V23e 8/128 RAM 8 ROM 128GB Handphone Smartphone Android Gadget Elegan,2479000.0,2.5,0,Meta Digital Pro,Medan,"stay store produk vivo v23e adalah produk unggulan terbaru dari vivo indonesia yang bisa menjawab kebutuhan kita baik dari segi fungsional, maupun estetika! mengusung  50mp ultra hd pada kamera depan yang dapat menghadirkan hasil foto yang jernih tanpa menghilangkan detail lainnya. dapatkan detail yang jelas dan hasil yang natural pada saat pengambilan gambar bahkan saat hasil gambar diperbesar sekalipun. percayakan fitur autofocus pada kamera depan untuk hasil foto yang fokus dan tajam sepanjang waktu. serta dapatkan hasil foto yang natural dan tetap jernih dalam jarak dekat maupun jauh. semuanya ini didapat dalam 7.36mm ultra slim body: tampil ramping dan ringan saat digenggam, v23e hadir dengan ketebalan hanya 7,36mm untuk warna moonlight shadow dan 7,41mm untuk warna sunshine coast dengan berat hanya 172 gram. bawalah v23e ke mana pun kamu pergi! spesifikasi processor mediatek g96 ram & rom	8gb+128gb battery	4050mah (typ) fast charging 44w (11v/4a) operating system funtouch os 12 body dimensions (lwh) 160.8774.287.36mm (moonlight shadow) 160.8774.287.41mm (sunshine coast) material glass display screen ""6.44-inch resolution display amoled touch screen screen touch id network frequency band network 2g gsm	b2/b3/b5/b8 3g wcdma b1/b5/b8 4g fdd_lte b1/b3/b5/b8 4g tdd_lte b40 card slot	1 nano sim +1 nano sim / 1 micro sd standby mode	dual sim dual standby (dsds) camera camera front 50mp af rear 64mp af + 8mp super wide-angle + 2mp super macro aperture""front: main f/2.0 rear : main f/1.8 super wide-angle f/2.2  super macro f/2.4 ready hydrogel anti gores cek link di bawah ini! terima kasih telah berbelanja di tempat kami",0.0,False,0.0,0.0,0.0,VIVO
https://www.tokopedia.com/jaswadi78/vivo-y35-ram-8gb-rom-256gb-hp-murah-8gb-ram-256gb-charge-5000mah?extParam=fcity%3D174%2C175%2C176%2C177%2C178%2C179%23144%2C146%2C150%2C151%2C167%2C168%2C171%2C174%2C175%2C176%2C177%2C178%2C179%2C463%23165%2346%23252%26ivf%3Dfalse%26keyword%3Dhp+murah%26search_id%3D202503010158437659E76192BAE0069WUB%26src%3Dsearch,"Vivo Y35 RAM 8GB ROM 256GB/HP Murah/8GB RAM + 256GB Charge + 5000mAh,",2430500.0,2.5,0,Jaswadi78,Surabaya,"vivo y35 ram 8gb rom 256gb/hp murah/8gb ram + 256gb charge + 5000mah, splash waterproof, 50mp camera",0.0,False,0.0,0.0,0.0,VIVO
https://www.tokopedia.com/aqilaastore32/promo-hp-oppo-a5s-murah?extParam=fcity%3D174%2C175%2C176%2C177%2C178%2C179%23144%2C146%2C150%2C151%2C167%2C168%2C171%2C174%2C175%2C176%2C177%2C178%2C179%2C463%23165%2346%23252%26ivf%3Dfalse%26keyword%3Dhp+murah%26search_id%3D202503010158437659E76192BAE0069WUB%26src%3Dsearch,Promo hp oppo a5s Murah,2700000.0,2.5,0,Aqilaastore32,Jakarta,oppo a5s 2gb ram 32gb rom   color red and black   sku : 3131/1521358767176237056/55,0.0,False,0.0,0.0,0.0,OPPO
https://www.tokopedia.com/tokoreyza6788/hp-oppo-murah-asli-oppo-a18-ram-4gb-rom-128gb-5000mah-baterai-terbaru?extParam=fcity%3D174%2C175%2C176%2C177%2C178%2C179%23144%2C146%2C150%2C151%2C167%2C168%2C171%2C174%2C175%2C176%2C177%2C178%2C179%2C463%23165%2346%23252%26ivf%3Dfalse%26keyword%3Dhp+murah%26search_id%3D202503010158437659E76192BAE0069WUB%26src%3Dsearch,Hp Oppo Murah Asli Oppo A18 RAM 4GB ROM 128GB 5000mAh Baterai Terbaru,3176000.0,2.5,0,Tokoreyza6788,Jakarta,hp oppo murah asli oppo a18 ram 4gb rom 128gb 5000mah baterai terbaru 2024 ori garansi resmi,0.0,False,0.0,0.0,0.0,OPPO
https://www.tokopedia.com/rsanjaya-6/ready-flash-sale-hp-murah-reno9-pro-5g-7-5inci-ponsel-jaminan?extParam=fcity%3D174%2C175%2C176%2C177%2C178%2C179%23144%2C146%2C150%2C151%2C167%2C168%2C171%2C174%2C175%2C176%2C177%2C178%2C179%2C463%23165%2346%23252%26ivf%3Dfalse%26keyword%3Dhp+murah%26search_id%3D20250301042531E7F72256397B2D1A4E75%26src%3Dsearch,Ready 【FLASH SALE】 hp murah Reno9 Pro+ 5G 7.5Inci Ponsel Jaminan,2956000.0,2.5,0,Robotek Sanjaya,Jakarta,"ready  produk memiliki masa garansi  semua produk dalam stok  pengiriman: pesanan akan tiba dalam waktu 2-3hari  produk: pengerjaan halus, desain cantik  deskripsi produk model: reno9 pro+ platform: android 11.0 4g / 5g lte siaga: kartu ekspansi kartu tf vertikal dua lapis layar: 7,5 inci frekuensi: gsm: 800/900/1800/1900, wcdma: 850/2100 warna: hitam,biru,sky biru memori: ram 12gb + rom 512gb kamera: 24mp + 58mp resolusi：1440*3040 multifungsi: pengenalan wajah, wifi mode tunggal, gps, sensor gravitasi, jam alarm, kalender, kalkulator, perekam audio, perekam video, wap/mms/gprs/, penampil gambar, tugas e-book, sampul iml bahasa: dukungan multi-bahasa baterai: baterai lithium-ion 5800mah  isi kemasan: 1 x adaptor pengisi daya 1 x kabel pengisi daya 1 x headset 1 x panduan pengguna 1 x casing ponsel 1 x film pelindung  •melayani: 1. semua produk 100% baru •menjamin kami mengembalikan uang, mengirim ulang atau yang terbaik untuk produk apa pun untuk produk yang rusak atau cacat.  •tips： jika terjadi kesalahan manusia (user error), produk tidak dapat dikembalikan atau ditukar, contoh: - terkena cairan - segel rusak atau hilang - terbakar - terjatuh / gompal / lecet",0.0,False,0.0,0.0,0.0,OPPO
