link,name,price,rating,total_sold,store_name,store_location,product_description,customer_satisfaction,IsRated,total_rating,num_reviews,review_rating_ratio,brand_name
https://www.tokopedia.com/samsung/samsung-galaxy-a05s-6-128gb-silver-e3ea5?extParam=ivf%3Dfalse%26keyword%3Dhp+murah&src=topads,Samsung Galaxy A05s 6/128GB,1999000.0,2.5,8000,Samsung Official Store,Jakarta,"""awesome offers! - free travel adapter 25w senilai rp.299.000** - free youtube premium 2 bulan* *syarat & ketentuan berlaku. klaim melalui aplikasi samsung gift indonesia. **selama persediaan masih ada"" spesifikasi : - processor : snapdragon 680 - size : 6.7"" - technology : pls lcd, 90 hz - resolution : fhd+ - rear camera resolution : 50mp + 2mp + 2mp - main camera auto focus : yes - rear camera - ois : no - rear camera - zoom : digital zoom up to 10x - front camera resolution : 13.0 mp - front camera auto focus : no - video resolution : fhd (1920 x 1080)@30fps - ram : 6gb - rom : 128gb - sim tray : dual-sim - network type :4g - usb interface : data cable c to c - usb version : usb 2.0 - earjack : yes - bluetooth version : bluetooth v5.1 - nfc : no - battery capacity : 5000mah 25w fast charging support - side fingerprint : yes",99.0,False,4155.0,1475.0,0.3549939831528279,Samsung
https://www.tokopedia.com/samsung/samsung-galaxy-a25-5g-8-256gb-blue-0a50b?extParam=ivf%3Dfalse%26keyword%3Dhp+murah&src=topads,Samsung Galaxy A25 5G 8/256GB,4049000.0,2.5,750,Samsung Official Store,Jakarta,"spesifikasi -processor : octa-core -size : 6.5"" -technology : super amoled 120hz -resolution : fhd+ -rear camera resolution : 50.0 mp + 8.0 mp + 2.0 mp -main camera auto focus : yes -rear camera - ois : yes -rear camera - zoom : digital zoom up to 10x -front camera resolution : 13.0 mp -front camera auto focus : no ""-video resolution : uhd 4k (3840 x 2160)@30fps slow motion: 480fps @hd,240fps @hd"" -ram : 8gb -rom : 256gb -sim tray : dual-sim -network type : 5g -usb interface : usb type-c -usb version : usb 2.1 -earjack : 3.5mm stereo -bluetooth version : bluetooth v5.3 -nfc : yes -battery capacity : 5000 mah -25w fast charging",98.0,False,438.0,169.0,0.3858447488584475,Samsung
https://www.tokopedia.com/distriponsel/xiaomi-redmi-14c-8-256-gb-6-128-gb-redmi-14-c-garansi-resmi-not-12-c-13-c-14c-6-128-black-non-bundle-f53bb?extParam=ivf%3Dtrue%26keyword%3Dhp+murah&src=topads,Xiaomi Redmi 14C 8/256 GB 6/128 GB Redmi 14 C Garansi Resmi Not 12 C 13 C,1385000.0,2.5,500,Distributor Ponsel,Jakarta,"untuk produk xiaomi, vivo, realme, oppo, samsung, infinix kami unseal semua yaa, hanya untuk aktivasi, selebihnya dijamin tidak ada yang ditukar/ganti tersedia juga aksesoris kompatible dengan produk ini : anti gores: https://www.tokopedia.com/distriponsel/anti-gores-jelly-tempered-glass-hydrogel-xiaomi-samsung-vivo-oppo-real tws: https://www.tokopedia.com/distriponsel/pioneer-earphone-series-headset-hp-murah-pioneer powerbank: https://www.tokopedia.com/distriponsel/realme-powerbank-power-bank-2i-10000mah-quick-charge-dual-output packing yang lebih aman (opsional, untuk standar packing kami sudah memakai bubble wrap) : ekstra bubble: https://www.tokopedia.com/distriponsel/ekstra-bubble-wrap-untuk-packing packing kayu: https://www.tokopedia.com/distriponsel/packing-kayu-untuk-handphone review customer distributor ponsel : https://www.tokopedia.com/distriponsel/review mengenai varian : non bundle / variant warna = tidak dapat bonus yang seperti digambar bundle headset = dapat bonus headset bundle powerbank = dapat bonus realme powerbank bundle hydrogel = dapat bonus anti gores hydrogel bundle lengkap = dapat semua bonus yang disebutkan diatas untuk varian promo barang sama, harga lebih murah karena varian tersebut dapat diskon dari tokopedia, untuk warna yang ready bisa cek divarian dan wajib cantumkan warna dicatatan ketika order. jika tidak, kami kirim sesuai stock yang tersedia dan tidak bisa komplain warna. *dengan syarat & ketentuan. tersedia 2 variant : xiaomi redmi 14c 6/128gb 8/256gb black, blue, purple xiaomi redmi 13c 6/128gb midnight black, green pastikan varian yang dipilih sudah sesuai, tidak diperbolehkan komplain karena salah pilih varian! spesifikasi produk : display type ips lcd, 120hz, 450 nits (typ), 600 nits (hbm) size 6.88 inches, 112.4 cm2 (~84.0% screen-to-body ratio) resolution 720 x 1640 pixels (~260 ppi density) platform os android 14, hyperos chipset mediatek helio g81 ultra cpu octa-core (2x2.0 ghz cortex-a75 & 6x1.8 ghz cortex-a55) gpu mali-g52 mc2 memory card slot microsdxc (dedicated slot) internal 128gb 4gb ram, 128gb 6gb ram, 128gb 8gb ram, 256gb 4gb ram, 256gb 8gb ram emmc 5.1 main camera dual 50 mp, f/1.8, 28mm (wide), pdaf 2 mp, f/2.4, (depth) 0.08 mp (auxiliary lens) features led flash, hdr video 1080p@30fps selfie camera single 13 mp, f/2.0 features hdr video 1080p@30fps sound loudspeaker yes 3.5mm jack yes comms wlan wi-fi 802.11 a/b/g/n/ac, dual-band bluetooth 5.4, a2dp, le positioning gps, glonass, galileo, bds nfc yes",98.0,False,206.0,78.0,0.3786407766990291,VIVO
https://www.tokopedia.com/tecnoofficialstore/tecno-pova-6-12-12gb-256gb-70w-ultra-charge-6000mah-5-tahun-proteksi-120hz-6-78-fhd-amoled-90fps-gyroscope-dual-speaker-dolby-atmos-ultra-thin-body-108mp-ultra-vivid-camera-android-14-garansi-12-1-bulan-comet-green-12-256gb-3321a?extParam=ivf%3Dfalse%26keyword%3Dhp+murah&src=topads,"TECNO POVA 6 - 12+12GB*+256GB, 70W Ultra Charge + 6000mAh + 5 Tahun Proteksi, 120Hz 6,78"" FHD+ Amoled, 90FPS Gyroscope, Dual Speaker Dolby Atmos, Ultra Thin Body, 108MP Ultra Vivid Camera, Android 14, Garansi 12+1 Bulan",2769000.0,2.5,500,Tecno Official Store,Jakarta,"keunggulan: mediatek helio g99 ultimate 6nm 6000mah + 70w ultra charge + proteksi baterry 5 tahun 120hz amoled 90 fps untuk mobile legend & free fire fingerprint on display big ram 8+8gb* / 12+12gb* (extended ram) big rom 256gb with expanded micro sd hard gyroscope, turbo light design, nfc double speaker by dolby atmos dual camera 108mp and 32mp selfie camera ultra thin body hios android 14 kelengkapan unit: perangkat x1 charger x1 kabel data usb type c x1 screen protector x1 (sudah terpasang) case pelindung x1sim ejektor x1 petunjuk pengguna x1 persyaratan keluhan tecno os: 1. simpan bukti resi dan pesanan anda dengan baik. 2. wajib membuat video unboxing saat menerima produk tecno yang masih tersegel. 3. cek segala kelengkapan unit tecno anda. 4. jika terdapat kekurangan dan kerusakan silakan menghubungi live chat tecno os. 5. cs akan mengarahkan langkah selanjutnya jika memberikan syarat 1 & 2.",98.0,False,371.0,169.0,0.4555256064690027,TECNO
https://www.tokopedia.com/tecnoofficialstore/tecno-spark-30c-6-6gb-128gb-120hz-display-sony-48mp-camera-helio-g81-5000mah-ip54-7-8mm-ultra-slim-nfc-garansi-12-1-bulan-orbit-white-d5cf9?extParam=ivf%3Dfalse%26keyword%3Dhp+murah&src=topads,"TECNO SPARK 30C – 6+6GB*+128GB, 120Hz Display, Sony 48MP Camera, Helio G81, 5000mAh, IP54, 7.8mm Ultra Slim, NFC, Garansi 12+1 Bulan",1429000.0,2.5,250,Tecno Official Store,Jakarta,"keunggulan: 48m main camera sony imx582 sensor 120hz 6.67"" hd+ smooth display 50-month lasting fluency 5000mah long-life battery infrared remote control dual symmetrical speakers+dts listen powerful octa-core processor extended ram 6+6gb* with big rom 128gb spesifikasi: ram : 6+6gb* memory : 128gb kamera depan : 8 mp clear front camera + dual flash kamera belakang: 48 mp sony imx582 + light sensor + dual flash jaringan : 4g fingerprint: side fingerprint type layar: ip54 dust & water resistance ukuran layar: 6.67"" hd+ refresh rate: 120hz display sistem operasi : android 14 sim card: dual nano sim prosesor: helio g81 dimensi: 165.7 x 77.1 x 7.8(7.95)mm konektivitas: gps, super wifi, bluetooth 5.0, nfc, infrared ir remote control kapasitas baterai: 5000mah kapasitas charge: 18 watt type-c fast charging sound: dual symmetrical speakers + dts listen kelengkapan unit: perangkat x1 charger x1 kabel data usb type c x1 case pelindung x1 sim ejektor x1 petunjuk pengguna x1 persyaratan keluhan tecno official store: 1. simpan bukti resi dan pesanan anda dengan baik. 2. wajib membuat video unboxing saat menerima produk tecno yang masih tersegel. 3. cek segala kelengkapan unit tecno anda. 4. jika terdapat kekurangan dan kerusakan silakan menghubungi live chat tecno official store. 5. customer service akan mengarahkan langkah selanjutnya jika memberikan syarat 1 & 2.",97.0,False,150.0,77.0,0.5133333333333333,TECNO
https://www.tokopedia.com/tecnoofficialstore/tecno-spark-go-1-4-4gb-128gb-120hz-display-t615-4-5g-network-5000mah-15w-ip54-android-14-garansi-12-1-bulan-startrail-black-c2cc6?extParam=ivf%3Dfalse%26keyword%3Dhp+murah&src=topads,"TECNO SPARK Go 1 – 4+4GB*+128GB, 120Hz Display, T615+4.5G Network, 5000mAh+15W, IP54, Android 14, Garansi 12+1 Bulan",1179000.0,2.5,250,Tecno Official Store,Jakarta,"spesifikasi: ram : 4gb+4gb* memory : 128gb kamera depan : 8 mp f2.0 - dual led flash kamera belakang: 13 mp f1.8 - dual led flash jaringan : 4.5g lightning network (100% faster than 4g) type layar: ip54 water resistance ukuran layar: punch hole display 6,67” refresh rate: 120hz sistem operasi : android 14 go edition sim card: dual nano sim prosesor: unisoc t615 dimensi: 165,62x77,01x8,35 mm konektivitas: gps, wifi, bluetooth, ir remote control kapasitas baterai: 5000mah(typ) kapasitas charge: 15 watt fast charging sound: dual speaker with dts effect kelengkapan unit: perangkat x1 charger x1 kabel data usb type c x1 case pelindung x1 sim ejektor x1 petunjuk pengguna x1 persyaratan keluhan tecno official store: 1. simpan bukti resi dan pesanan anda dengan baik. 2. wajib membuat video unboxing saat menerima produk tecno yang masih tersegel. 3. cek segala kelengkapan unit tecno anda. 4. jika terdapat kekurangan dan kerusakan silakan menghubungi live chat tecno official store. 5. customer service akan mengarahkan langkah selanjutnya jika memberikan syarat 1 & 2.",98.0,False,195.0,85.0,0.4358974358974359,TECNO
https://www.tokopedia.com/wahanaacesories/hp-vivo-y91-2-32gb-y91-32gb-vivo-y-91-2gb-rom-32gb-garansi-resmi-v-hitam?extParam=ivf%3Dfalse%26keyword%3Dhp+murah&src=topads,HP VIVO Y91 2/32GB (Y91 32GB) - VIVO Y 91 2GB ROM 32GB GARANSI RESMI V,1750000.0,2.5,100,Wahana Accessories,Jakarta,"pengiriman cepat dan dijamin sampai tujuan anda. packing lebih aman dengan menggunakan buble warp ( free ).  spesifikasi vivo y91: ram 2 gb rom 32 gb layar 6,22 inch baterai 4030mah face unlock + fingerprint kamera depan 5mp dual kamera belakang 13mp + 2mo android oreo 8.1 dual sim card memory up to 256gb  garansi resmi vivo indonesia  jangan lupa juga di order aksesorisnya ya * scrrenn protector https://www.tokopedia.com/wahanaacesories/temperred-glass-vivo-y91-anti-gores-kaca-vivo-y91-screen-guard-viv",100.0,False,49.0,29.0,0.5918367346938775,VIVO
https://www.tokopedia.com/archive-carmineshopp-1630682472/samsung-galaxy-m10-samsung-m10-hp-samsung-murah-samsung-original?extParam=fcity%3D174%2C175%2C176%2C177%2C178%2C179%23144%2C146%2C150%2C151%2C167%2C168%2C171%2C174%2C175%2C176%2C177%2C178%2C179%2C463%23165%2346%23252%26ivf%3Dfalse%26keyword%3Dhp+murah%26search_id%3D202503010158437659E76192BAE0069WUB%26src%3Dsearch,SAMSUNG GALAXY M10 / SAMSUNG M10 / HP SAMSUNG MURAH / SAMSUNG ORIGINAL,2349900.0,5.0,100,Carmine Shop,Bandung,"dijamin original yaa sisss.. jangan terkecoh dengan harga yang murah ada harga - ada kualitas gan foto boleh sama, harga boleh di bawah kami tapi kami pastikan produk dan pelayanan kami jauh lebih berkualitas gan.... mohon dibaca baik-baik sebelum order!! warna : black, blue samsung galaxy m10 with a 15.8cm (6.22”) hd+ infinity v display it’s time to take your phone viewing experience to the next level with a powerful 15.8cm (6.22"") infinity v display. i’m social with ultra-wide dual rear camera now shoot from one extreme to the other without fomo. set #squadgoals by clicking group photos from the ultra wide dual rear camera. i’m fab with 13mp/f1.9 + live focus get perfect shots in low light with f1.9 aperture & great portrait shots with live focus feature. i’m more with 5mp f2.0 front camera and in-display flash just fire up the front camera for lit selfies on your social feed with the in-display flash and f2.0 aperture. i’m quick with the 1.6ghz exynos octa core processor do more with your phone and do it faster than ever before with the powerful 1.6ghz exynos octa core processor. i’m slim with a 7.7mm body & premium colours the galaxy m10 has a stunning 7.7mm slim design & is available in premium colours - charcoal black and ocean blue. i’m fun with widevine l1 certification to view hd now livestream your favorite hd content with the widevine l1 certification. i’m secure with fast face unlock use personalised protection to unlock your phone quickly. i’m unstoppable with 3400 mah battery the galaxy m10 is built for the long haul action so that you stay in charge. ************** order = setuju dengan deskripsi di atas (no komplain) ***************** ""stock cepat habis mohon pastikan fix order sebelum check out agar tidak terjadi pembatalan"" jangan sampai nyesel gak beli barang kece ini... selamat berbelanjaaa.......^^",100.0,True,25.0,25.0,1.0,Samsung
https://www.tokopedia.com/wahanaacesories/oppo-a3s-ram-3gb-rom-32gb-garansi-resmi-oppo-ungu-purple-merah?extParam=ivf%3Dfalse%26keyword%3Dhp+murah&src=topads,OPPO A3S RAM 3GB ROM 32GB GARANSI RESMI OPPO - UNGU/PURPLE,1699000.0,2.5,100,Wahana Accessories,Jakarta,"oppo a3s 3gb ram 32gb internal  garansi resmi produk ready stok ungu dan merah silakan langsung diorder sis/gan  spesifikasi :   network technology  gsm / hspa / lte launch announced 2018, july status available. released 2018, july body dimensions 156.2 x 75.6 x 8.2 mm (6.15 x 2.98 x 0.32 in) weight 168 g (5.93 oz) sim dual sim (nano-sim, dual stand-by) display type ips lcd capacitive touchscreen, 16m colors size 6.2 inches, 95.9 cm2 (~81.2% screen-to-body ratio) resolution 720 x 1520 pixels, 19:9 ratio (~271 ppi density) multitouch yes  - color os 5.1 platform os android 8.1 (oreo) chipset qualcomm sdm450 snapdragon 450 cpu octa-core 1.8 ghz cortex-a53 gpu adreno 506 memory card slot microsd, up to 256 gb (dedicated slot) internal 32 gb, 3gb ram main camera dual 13 mp, f/2.2, af 2 mp, f/2.4, depth sensor features led flash, hdr, panorama video 1080p@30fps selfie camera single 8 mp, f/2.2 video  sound alert types vibration; mp3, wav ringtones loudspeaker yes 3.5mm jack yes  - active noise cancellation with dedicated mic comms wlan wi-fi 802.11 b/g/n, wifi direct, hotspot bluetooth 4.2, a2dp, le gps yes, with a-gps radio fm radio usb microusb 2.0, usb on-the-go features sensors accelerometer, proximity, compass messaging sms(threaded view), mms, email, push email browser html5  - mp4/h.264/flac player - mp3/eaac+/wav player - document viewer - photo viewer/editor battery  non-removable li-ion 4230 mah battery  *free bubble wrap",93.0,False,78.0,49.0,0.6282051282051282,OPPO
https://www.tokopedia.com/laku9/xiaomi-redmi-12c-128gb-new-garansi-resmi-mi-12-c-4-128-4-64-3-32-biru-3-32-57b28?extParam=ivf%3Dfalse%26keyword%3Dhp+murah&src=topads,Xiaomi Redmi 12C 128GB NEW Garansi Resmi Mi 12 C 4/128 4/64 3/32,1099000.0,2.5,80,Laku9,Jakarta,"xiaomi redmi 12c 100% bnib new dan garansi resmi xiaomi indonesia atau dana kembali utuh jaringan gsm / cdma / hspa / evdo / lte sistem operasi android 12 prosesor mediatek mt6769z helio g85 (12nm), octa-core (2x2.0 ghz cortex-a75 & 6x1.8 ghz cortex-a55) gpu mali-g52 mc2 ram 4/3 gb kapasitas 128/64/32 gb ukuran layar 6.71 inch tipe layar ips lcd, 500 nits (typ) resolusi layar 720 x 1650 pixels (~268 ppi density) kamera belakang dual 50 mp, (wide), pdaf 0.08 mp (depth kamera depan 5 mp audio loudspeaker & 3.5mm jack wlan wi-fi 802.11 a/b/g/n/ac, dual-band, wi-fi direct bluetooth 5.1, a2dp, le gps gps, glonass, bds, galileo sensor fingerprint (rear-mounted), accelerometer virtual proximity sensing baterai 5000 mah pengisian daya 10w wired slot memori eksternal microsd slot sim dual nano sim berat 192 gr dimensi 168.8 x 76.4 x 8.8 mm",97.0,False,38.0,17.0,0.4473684210526316,Xiaomi
https://www.tokopedia.com/rrnumerouno/samsung-a25-5g-nfc-8-256gb-garansi-resmi-black-8-128gb-blue-black-8-256gb-2edcb?extParam=ivf%3Dfalse%26keyword%3Dhp+murah&src=topads,"Samsung A25 5G NFC 8/256Gb garansi resmi - black -8/128GB - Blue Black, 8/256GB",3620000.0,2.5,70,Rr Numero Uno,Depok,"spesifikasi -processor : octa-core -size : 6.5"" -technology : super amoled 120hz -resolution : fhd+ -rear camera resolution : 50.0 mp + 8.0 mp + 2.0 mp -main camera auto focus : yes -rear camera - ois : yes -rear camera - zoom : digital zoom up to 10x -front camera resolution : 13.0 mp -front camera auto focus : no ""-video resolution : uhd 4k (3840 x 2160)@30fps slow motion: 480fps @hd,240fps @hd"" -ram : 8gb -rom : 256gb -sim tray : dual-sim -network type : 5g -usb interface : usb type-c -usb version : usb 2.1 -earjack : 3.5mm stereo -bluetooth version : bluetooth v5.3 -nfc : yes -battery capacity : 5000 mah",100.0,False,36.0,16.0,0.4444444444444444,Samsung
https://www.tokopedia.com/rnr307/realme-note-60-nfc-6gb-128gb-new-garansi-resmi-biru-4-64-7f6a4?extParam=ivf%3Dfalse%26keyword%3Dhp+murah&src=topads,"Realme Note 60 NFC 6GB 128GB new garansi resmi - Biru, 4/64",1135000.0,2.5,30,Rnr301,Depok,"imei terdaftar garansi resmi pesanan yg masuk sebelom jam 18.00 wib akan kami kirim di hari yang sama..begitu juga sebaliknya lewat dari jam 18.00 akan kami kirim dihari berikutnya. mohon sertakan video unboxing lengkap tanpa jeda, edit, putus-putus untuk melakukan komplain kendala pesanan yg diterima.",100.0,False,11.0,2.0,0.1818181818181818,Realme
https://www.tokopedia.com/cuan-gadgetid/realme-c67-4g-nfc-8-256-realme-c-67-4g-8-128-garansi-resmi-indonesia-8-128-black-tanpa-bonus-864db?extParam=ivf%3Dfalse%26keyword%3Dhp+murah&src=topads,REALME C67 4G NFC 8/256 REALME C 67 4G 8/128 GARANSI RESMI INDONESIA,2999000.0,2.5,30,Cuan Gadget.Id,Bekasi,"realme c67 ram 8gb rom 128gb realme c67 ram 8gb rom 256gb (up to 16gb ram *8+8 extended ram) garansi resmi 1 tahun realme indonesia -100% produk original -100% produk baru -100% produk segel -100% imei terdaftar di kemenperin garansi : -handphone : 1 tahun -software: lifetime warranty -kepala charger : 6 bulan -usb cable : 6 bulan -battery : 6 bulan note : claim garansi dan asuransi dapat dilakukan di seluruh service center realme indonesia warna : - sunny oasis - black rock paket bonus cuan : 1. realme buds plus / olike wireless speaker / vr box / xiaomi airdots tws / jbl go 3 / powerbank / gaming fan cooler / smartband 2. free asuransi pengiriman 3. masker 1 box isi 50pcs 4. mask bracket 5. mask connector 6. tempered glass 7. kartu perdana 8. cuangadgetid official lanyard 9. kipas otg 10. led stick 11. stand card holder 12. waterproof 13. i-ring 14. gurita 15. pop socket 16. gaming finger sleeve 17. simcard adapter 18. otg type c 19. pelindung kabel 20. gantungan hp *setiap pembelian akan mendapatkan paket bonus cuan yang tertera diatas **jika ada item kosong maka akan diganti dengan item lain yang senilai note : jika anda memiliki pertanyaan, silakan chat dengan admin kami melalui inbox, kami akan menjawab pertanyaan anda secara detail.",100.0,False,27.0,12.0,0.4444444444444444,Xiaomi
https://www.tokopedia.com/archive-hanzohh/hp-android-terbaru-merk-prince-pc9-spek-lengkap-harga-murah-ram-2gb-ja?extParam=fcity%3D174%2C175%2C176%2C177%2C178%2C179%23144%2C146%2C150%2C151%2C167%2C168%2C171%2C174%2C175%2C176%2C177%2C178%2C179%2C463%23165%2346%23252%26ivf%3Dfalse%26keyword%3Dhp+murah%26search_id%3D202503010158437659E76192BAE0069WUB%26src%3Dsearch,Hp Android Terbaru Merk Prince PC9 spek lengkap harga murah ram 2GB ja,1000000.0,5.0,30,Hanzo6645,Medan,"hp android produk terbaru dengan spesifikasi: - layar 5.72 inch full hd - ram 2gb rom 16gb - kamera depan 8mp, kamera belakang 13mp - battery 3200 mah - fingerprint sensor - android 8.1 - double kamera - jaringan 4g kelengkapan : kotak, battery, charger, headset, kartu garansi, manual book, free anti gores + jelly case",100.0,True,4.0,0.0,0.0,Prince
https://www.tokopedia.com/gesrek/vivo-v40-lite-4g-5g-8-128-8-256-garansi-resmi-purple-4g-8-128gb-3937d?extParam=ivf%3Dfalse%26keyword%3Dhp+murah&src=topads,Vivo V40 Lite 4G 5G 8/128 8/256 - Garansi RESMI,3140000.0,2.5,30,Gesrek Phone,Depok,"- konfirmasi warna sebelum order ( cantumkan warna di noted ) - new - ada toko offline di depok (bisa cod) - garansi resmi vivo indonesia 1 tahun - proses hari ini max 19:30 , kirim hari ini terima credit via online tokopedia - kredivo , lakulaku terima credit via offline di depok - homecredit , aeon",100.0,False,18.0,9.0,0.5,VIVO
https://www.tokopedia.com/meyshabeauty/hp-murah-xiaomi-redmi-4x-16gb-2gb-32gb-3gb-octa-8-core-2-16gb-black?extParam=fcity%3D174%2C175%2C176%2C177%2C178%2C179%23144%2C146%2C150%2C151%2C167%2C168%2C171%2C174%2C175%2C176%2C177%2C178%2C179%2C463%23165%2346%23252%26ivf%3Dfalse%26keyword%3Dhp+murah%26search_id%3D202503010158437659E76192BAE0069WUB%26src%3Dsearch,HP Murah Xiaomi Redmi 4X 16GB 2GB 32GB 3GB Octa 8 Core,1300000.0,5.0,29,Meysha Beauty,Jakarta,"network technology  gsm / hspa / lte launch announced 2017, may status available. released 2017, may body dimensions 139.2 x 70 x 8.7 mm (5.48 x 2.76 x 0.34 in) weight 150 g (5.29 oz) build glass front (gorilla glass), aluminum back, aluminum frame, plastic ends sim hybrid dual sim (nano-sim/ micro-sim, dual stand-by) display type ips lcd size 5.0 inches, 68.9 cm2 (~70.7% screen-to-body ratio) resolution 720 x 1280 pixels, 16:9 ratio (~294 ppi density) protection corning gorilla glass (unspecified version) platform os android 6.0.1 (marshmallow), upgradable to 7.1.2 (nougat), miui 11 chipset qualcomm msm8940 snapdragon 435 (28 nm) cpu octa-core 1.4 ghz cortex-a53 gpu adreno 505 memory card slot microsdxc (uses shared sim slot) internal 16gb 2gb ram, 16gb 3gb ram, 32gb 3gb ram, 64gb 3gb ram, 64gb 4gb ram emmc 5.1 main camera single 13 mp, f/2.0, pdaf features led flash, hdr, panorama video 1080p@30fps selfie camera single 5 mp, f/2.2 video 1080p@30fps sound loudspeaker yes 3.5mm jack yes comms wlan wi-fi 802.11 b/g/n, wi-fi direct, hotspot bluetooth 4.2, a2dp, le gps yes, with a-gps, glonass, bds nfc no infrared port yes radio fm radio usb microusb 2.0 features sensors fingerprint (rear-mounted), accelerometer, gyro, proximity, compass battery type li-po 4100 mah, non-removable stand-by up to 432 h (3g) talk time up to 36 h (3g) music play up to 87 h misc colors black, gold models 2016060, 2016090, mag138, mae136, redmi 4, redmi 4x sar 0.77 w/kg (head) 0.83 w/kg (body)  price about 110 eur tests performance geekbench: 1819 (v4.4) gfxbench: 5.1fps (es 3.1 onscreen) display contrast ratio: 915 (nominal), 2.920 (sunlight) camera photo / video loudspeaker voice 64db / noise 70db / ring 72db audio quality noise -94.3db / crosstalk -94db battery life  endurance rating 80h",100.0,True,7.0,2.0,0.2857142857142857,Xiaomi
https://www.tokopedia.com/oktobermart/hp-oppo-a54-new-2021-ram-4-128gb-garansi-resmi-hrg-murah-banyak-bonus-hitam?extParam=fcity%3D174%2C175%2C176%2C177%2C178%2C179%23144%2C146%2C150%2C151%2C167%2C168%2C171%2C174%2C175%2C176%2C177%2C178%2C179%2C463%23165%2346%23252%26ivf%3Dfalse%26keyword%3Dhp+murah%26search_id%3D202503010158437659E76192BAE0069WUB%26src%3Dsearch,Hp oppo A54 New 2021 ram 4/128gb garansi resmi hrg murah banyak bonus,2550000.0,5.0,24,Oktober Mart,Jakarta,"hp oppo a54 new 2021 ram 4gb internal 128gb garansi resmi technologygsm / hspa / lte2g bandsgsm 850 / 900 / 1800 / 1900 - sim 1 & sim 23g bandshsdpa 850 / 900 / 21004g bands1, 3, 5, 8, 38, 40, 41speedhspa 42.2/5.76 mbps, lte-alaunchannounced2021, march 26statusavailable. released 2021, april 01bodydimensions163.6 x 75.7 x 8.4 mm (6.44 x 2.98 x 0.33 in)weight192 g (6.77 oz)simdual sim (nano-sim, dual stand-by)displaytypeips lcdsize6.51 inches, 102.3 cm2 (~82.6% screen-to-body ratio)resolution720 x 1600 pixels, 20:9 ratio (~270 ppi density)platformosandroid 10, coloros 7.2chipsetmediatek mt6765 helio p35 (12nm)cpuocta-core (4x2.35 ghz cortex-a53 & 4x1.8 ghz cortex-a53)gpupowervr ge8320memorycard slotmicrosdxc (dedicated slot)internal64gb 4gb ram, 128gb 4gb rammain cameratriple13 mp, f/2.2, 25mm (wide), 1/3.06"", 1.12µm, pdaf 2 mp, f/2.4, (macro) 2 mp, f/2.4, (depth)featuresled flash, hdr, panoramavideo1080p@30fpsselfie camerasingle16 mp, f/2.0, (wide), 1/3.06"", 1.0µmfeatureshdrvideo1080p@30fpssoundloudspeakeryes3.5mm jackyescommswlanwi-fi 802.11 a/b/g/n/ac, dual-band, wi-fi direct, hotspotbluetooth5.0, a2dp, le, aptx hdgpsyes, with a-gps, glonass, galileo, bdsnfcnoradiofm radiousbusb type-c 2.0, usb on-the-gofeaturessensorsfingerprint (side-mounted), accelerometer, proximity, compassmessagingsms(threaded view), mms, email, push email, imbrowserhtml5batterytypeli-po 5000 mah, non-removablechargingfast charging 18wmisccolorscrystal black, starry blue",100.0,True,3.0,1.0,0.3333333333333333,OPPO
